{
  "counts_by_result": {
    "SUPPORTED": 1,
    "UNSUPPORTED": 20
  },
  "dangling": {
    "missing_paths": [],
    "unknown_claim_ids": [],
    "unknown_dod_ids": [],
    "unknown_evidence_ids": [],
    "unknown_gate_ids": []
  },
  "every_claim_names_required_evidence": true,
  "gap_owners": [
    "curation lead",
    "expert review chair",
    "expert reviewer",
    "platform owner",
    "release approver",
    "scientific source approver",
    "security owner",
    "validation owner"
  ],
  "has_dangling_reference": false,
  "note": "A row is SUPPORTED only when its Definition of Done item is satisfied and every gate it feeds passes.",
  "p0_dod_014_basis": "satisfied exactly when the matrix resolves with no dangling identifier or path and every claim names required evidence; this is the one Definition of Done item WP-25 can discharge by itself, and discharging it says nothing about the other fourteen",
  "p0_dod_014_satisfied": true,
  "row_count": 21,
  "rows": [
    {
      "claim_ids": [
        "THS6-CLAIM-001"
      ],
      "dod_ids": [
        "P0-DOD-001"
      ],
      "evidence_ids": [
        "EV-WP16-001",
        "EV-WP16-003",
        "EV-WP17-001",
        "EV-WP17-002"
      ],
      "gap": "the prototype exists and renders; what it has never rendered is a result computed from an approved dataset and ruleset",
      "gap_owner": "platform owner",
      "gate_ids": [
        "GATE-C"
      ],
      "implementation_paths": [
        "apps/web/main.py",
        "apps/api/main.py",
        "pgx/application/assessment_service.py"
      ],
      "requirement": "One integrated web prototype runs the representative workflow.",
      "requirement_source": "architecture.md section 21",
      "result": "UNSUPPORTED",
      "row_id": "TRACE-P0-DOD-001",
      "test_paths": [
        "tests/unit/web/test_e2e_flow.py",
        "tests/unit/api/test_assessment_flow.py"
      ]
    },
    {
      "claim_ids": [
        "THS6-CLAIM-002"
      ],
      "dod_ids": [
        "P0-DOD-002"
      ],
      "evidence_ids": [
        "EV-WP14-001",
        "EV-WP14-002",
        "EV-WP15-003"
      ],
      "gap": "determinism is demonstrated over fixtures; 'for the same release' has no referent while no release is active",
      "gap_owner": "release approver",
      "gate_ids": [
        "GATE-C"
      ],
      "implementation_paths": [
        "pgx/engine/",
        "pgx/application/assessment_snapshot.py"
      ],
      "requirement": "Assessment facts are deterministic for the same release and input.",
      "requirement_source": "architecture.md section 21",
      "result": "UNSUPPORTED",
      "row_id": "TRACE-P0-DOD-002",
      "test_paths": [
        "tests/unit/reporting/test_determinism.py"
      ]
    },
    {
      "claim_ids": [
        "THS6-CLAIM-003"
      ],
      "dod_ids": [
        "P0-DOD-003"
      ],
      "evidence_ids": [
        "EV-WP08-002",
        "EV-WP15-001",
        "EV-WP15-005"
      ],
      "gap": "no report has been produced, so the property holds vacuously and is recorded as unsatisfied rather than as met",
      "gap_owner": "curation lead",
      "gate_ids": [
        "GATE-C"
      ],
      "implementation_paths": [
        "pgx/reporting/",
        "pgx/evidence/build.py"
      ],
      "requirement": "Every finding has traceable evidence.",
      "requirement_source": "architecture.md section 21",
      "result": "UNSUPPORTED",
      "row_id": "TRACE-P0-DOD-003",
      "test_paths": [
        "tests/unit/reporting/test_fact_preservation.py"
      ]
    },
    {
      "claim_ids": [
        "THS6-CLAIM-004"
      ],
      "dod_ids": [
        "P0-DOD-004"
      ],
      "evidence_ids": [
        "EV-WP13-002",
        "EV-WP13-003",
        "EV-WP20-005"
      ],
      "gap": "the invariant is implemented and proven over fixtures; it has never been exercised over governed content because none exists",
      "gap_owner": "curation lead",
      "gate_ids": [
        "GATE-C"
      ],
      "implementation_paths": [
        "pgx/engine/coverage_validator.py",
        "pgx/safety/"
      ],
      "requirement": "Missing data is never shown as low/no risk; coverage is separate.",
      "requirement_source": "architecture.md section 21",
      "result": "UNSUPPORTED",
      "row_id": "TRACE-P0-DOD-004",
      "test_paths": [
        "tests/unit/engine/test_coverage_aggregation.py",
        "tests/unit/safety/test_invariant_001.py"
      ]
    },
    {
      "claim_ids": [
        "THS6-CLAIM-005",
        "THS6-CLAIM-006"
      ],
      "dod_ids": [
        "P0-DOD-005"
      ],
      "evidence_ids": [
        "EV-WP03-003",
        "EV-WP06-002",
        "EV-WP11-001",
        "EV-WP24-003",
        "EV-WP24-004",
        "EV-WP24-016"
      ],
      "gap": "the registry design is implemented; no dataset is published, no ruleset is frozen, and no rollback has been executed",
      "gap_owner": "release approver",
      "gate_ids": [
        "GATE-A",
        "GATE-B",
        "GATE-E"
      ],
      "implementation_paths": [
        "pgx/application/release_service.py",
        "pgx/deployment/provenance.py",
        "pgx/deployment/rollback.py"
      ],
      "requirement": "Software, dataset, and ruleset are independently versioned and rollback works.",
      "requirement_source": "architecture.md section 21",
      "result": "UNSUPPORTED",
      "row_id": "TRACE-P0-DOD-005",
      "test_paths": [
        "tests/unit/deployment/test_container_and_build.py"
      ]
    },
    {
      "claim_ids": [
        "THS6-CLAIM-007"
      ],
      "dod_ids": [
        "P0-DOD-006"
      ],
      "evidence_ids": [
        "EV-WP18-001",
        "EV-WP18-003",
        "EV-WP21-002"
      ],
      "gap": "zero exist; the seven development cases are excluded by contract and must never be counted towards this bullet",
      "gap_owner": "validation owner",
      "gate_ids": [
        "GATE-D"
      ],
      "implementation_paths": [
        "pgx/validation/"
      ],
      "requirement": "At least 50 serious validation cases exist, with a preference for 100+.",
      "requirement_source": "architecture.md section 21",
      "result": "UNSUPPORTED",
      "row_id": "TRACE-P0-DOD-006",
      "test_paths": [
        "tests/unit/validation/test_cases.py",
        "tests/unit/validation/test_manifests_and_catalog.py"
      ]
    },
    {
      "claim_ids": [
        "THS6-CLAIM-008"
      ],
      "dod_ids": [
        "P0-DOD-007"
      ],
      "evidence_ids": [
        "EV-WP18-002",
        "EV-WP18-003",
        "EV-WP18-006"
      ],
      "gap": "the separation audit runs and passes over seven development cases, which is a check with nothing to separate them from",
      "gap_owner": "validation owner",
      "gate_ids": [
        "GATE-D"
      ],
      "implementation_paths": [
        "pgx/validation/"
      ],
      "requirement": "An independent holdout set was not used for rule development.",
      "requirement_source": "architecture.md section 21",
      "result": "UNSUPPORTED",
      "row_id": "TRACE-P0-DOD-007",
      "test_paths": [
        "tests/unit/validation/test_separation.py"
      ]
    },
    {
      "claim_ids": [
        "THS6-CLAIM-009"
      ],
      "dod_ids": [
        "P0-DOD-008"
      ],
      "evidence_ids": [
        "EV-WP20-001",
        "EV-WP20-004",
        "EV-WP20-007"
      ],
      "gap": "twelve invariants execute locally and pass; the workflow file is configured and has never been run by a provider",
      "gap_owner": "platform owner",
      "gate_ids": [
        "GATE-C"
      ],
      "implementation_paths": [
        "pgx/safety/",
        ".github/workflows/safety-gate.yml"
      ],
      "requirement": "All safety invariants pass in CI.",
      "requirement_source": "architecture.md section 21",
      "result": "UNSUPPORTED",
      "row_id": "TRACE-P0-DOD-008",
      "test_paths": [
        "tests/unit/safety/test_gate.py"
      ]
    },
    {
      "claim_ids": [
        "THS6-CLAIM-010"
      ],
      "dod_ids": [
        "P0-DOD-009"
      ],
      "evidence_ids": [
        "EV-WP22-001",
        "EV-WP22-002",
        "EV-WP22-006"
      ],
      "gap": "the review machinery is implemented and empty; no protocol signatory and no named reviewer exist",
      "gap_owner": "expert review chair",
      "gate_ids": [
        "GATE-D"
      ],
      "implementation_paths": [
        "pgx/expert_review/"
      ],
      "requirement": "Blind-first expert review is completed under the approved protocol.",
      "requirement_source": "architecture.md section 21",
      "result": "UNSUPPORTED",
      "row_id": "TRACE-P0-DOD-009",
      "test_paths": [
        "tests/unit/expert_review/test_state_machine.py",
        "tests/unit/expert_review/test_blinding.py"
      ]
    },
    {
      "claim_ids": [
        "THS6-CLAIM-011"
      ],
      "dod_ids": [
        "P0-DOD-010"
      ],
      "evidence_ids": [
        "EV-WP17-001",
        "EV-WP22-001",
        "EV-WP22-003"
      ],
      "gap": "an eight-step workflow is implemented; nobody has walked it",
      "gap_owner": "expert review chair",
      "gate_ids": [
        "GATE-D"
      ],
      "implementation_paths": [
        "pgx/expert_review/",
        "apps/web/main.py"
      ],
      "requirement": "Experts use the representative workflow, not only static reports.",
      "requirement_source": "architecture.md section 21",
      "result": "UNSUPPORTED",
      "row_id": "TRACE-P0-DOD-010",
      "test_paths": [
        "tests/unit/web/test_expert_review_flow.py"
      ]
    },
    {
      "claim_ids": [
        "THS6-CLAIM-012"
      ],
      "dod_ids": [
        "P0-DOD-011"
      ],
      "evidence_ids": [
        "EV-WP21-001",
        "EV-WP21-002",
        "EV-WP21-003"
      ],
      "gap": "fifteen metric definitions exist and no metric has a value; a definition is not a measurement",
      "gap_owner": "validation owner",
      "gate_ids": [
        "GATE-D"
      ],